职位名称,职位地址,薪资,学历经验要求,公司名称,公司信息,公司福利,详情页链接
python开发,上海·浦东新区·金桥,18-30K,1-3年本科,上海华为技术有限公司,通信/网络设备不需要融资10000人以上,股票期权，定期体检，零食下午茶，员工旅游，年终奖，五险一金，带薪年假，加班补助，节日福利,https://www.zhipin.com/job_detail/6b9510c3c4ac4d1a1n1_39S1F1pS.html
Python工程师,上海·浦东新区·陆家嘴,15-25K,1年以内本科,俊丹私募基金,基金0-20人,,https://www.zhipin.com/job_detail/07289c73b187226f1XR709m0EVpX.html
Python开发工程师,上海·徐汇区·岳阳,7-10K,1-3年本科,黑洞盒信息科技有...,计算机软件20-99人,,https://www.zhipin.com/job_detail/513de1a4b2ecb3091XRz39i4EVJW.html
资深Python工程师,上海·普陀区·武宁,30-60K,5-10年本科,信天翁信息科技,互联网B轮500-999人,带薪年假，定期体检，五险一金，股票期权，节日福利，年终奖,https://www.zhipin.com/job_detail/6b1d900da11787531nFz29q4FFpS.html
python应用开发,上海·浦东新区·联洋,15-30K,3-5年本科,至明科技,互联网20-99人,,https://www.zhipin.com/job_detail/2a53982b9f75ba821nN729u1EltZ.html
python工程师,上海·浦东新区·张江,20-35K·13薪,1-3年本科,逾谦科技,移动互联网不需要融资0-20人,股票期权，五险一金，年终奖，带薪年假，员工旅游,https://www.zhipin.com/job_detail/cfc66eb1c2dc912c1nFy3di0FFpU.html
python开发工程师,上海·嘉定区·江桥,12-20K,1-3年大专,奥软信息,计算机软件20-99人,,https://www.zhipin.com/job_detail/176a9c508cc2d2e01n1-3tS6EFBY.html
Python开发工程师,上海·浦东新区·张江,15-25K,1-3年本科,软通动力信息技术集团,计算机软件已上市10000人以上,餐补，免费班车，五险一金，节日福利，员工旅游，年终奖，通讯补贴，交通补助，零食下午茶，包吃，全勤奖，定期体检，加班补助，补充医疗保险，带薪年假,https://www.zhipin.com/job_detail/80000494fd829a1f1XZ-0tu-E1RR.html
python工程师,上海·普陀区·长风,20-25K,1-3年本科,众标科技,数据服务不需要融资20-99人,餐补，零食下午茶，股票期权，五险一金，年终奖，员工旅游，带薪年假,https://www.zhipin.com/job_detail/d77727d68b7dbf751nFy3di9EVBT.html
Python后端开发工程师,上海·长宁区·新华路,11-16K·16薪,1-3年本科,洪朴信息,数据服务A轮20-99人,带薪年假，交通补助，节日福利，年终奖，定期体检，五险一金，员工旅游，零食下午茶,https://www.zhipin.com/job_detail/d4f5e65465f2b0421XR_39q1EVRY.html
Python开发工程师,上海,200-300元/天,5天/周3个月本科,bilibili,互联网已上市10000人以上,年终奖，定期体检，员工旅游，零食下午茶，通讯补贴，交通补助，五险一金，带薪年假，餐补，全勤奖，股票期权，节日福利，包吃，补充医疗保险,https://www.zhipin.com/job_detail/b3218e72b9627d0a1nJ_0tm7EFpZ.html
Python开发工程师,上海·闵行区·虹桥,8-13K,1-3年本科,能资科技,计算机软件未融资20-99人,五险一金，员工旅游，年终奖，股票期权，带薪年假，定期体检，全勤奖,https://www.zhipin.com/job_detail/b2cdd14409bce9f71XV839S1FVJV.html
Python开发工程师,上海·浦东新区·张江,20-35K·13薪,3-5年本科,富欣通信,通信/网络设备未融资100-499人,年终奖，定期体检，零食下午茶，节日福利，带薪年假，加班补助，餐补，员工旅游，五险一金，免费班车,https://www.zhipin.com/job_detail/bb7fb2df86f802fb1n180ti-GFZR.html
python研发工程师,上海·浦东新区·陆家嘴,15-30K,经验不限本科,招鲤,互联网A轮0-20人,年终奖，员工旅游，带薪年假，零食下午茶，五险一金，餐补，定期体检，节日福利，股票期权,https://www.zhipin.com/job_detail/8cc56d49d86608351nZ90t21E1RT.html
Python（应届生）,上海·浦东新区·张江,6-11K,经验不限本科,上海敏智,计算机软件未融资20-99人,餐补，带薪年假，节日福利，零食下午茶，全勤奖，员工旅游，加班补助，五险一金，年终奖,https://www.zhipin.com/job_detail/971b0802bafe67ee1n183t-9E1ZS.html
python编程助教,上海·杨浦区·五角场,8-10K,1-3年本科,佑棵智能科技有限公司,院校20-99人,,https://www.zhipin.com/job_detail/94a61cfd89c1428f1nJ529y9FFtZ.html
Python开发工程师,上海·浦东新区·金桥,20-40K,3-5年本科,华为技术有限公司,计算机软件不需要融资10000人以上,定期体检，免费班车，零食下午茶，五险一金，住房补贴，员工旅游，加班补助，带薪年假，交通补助，节日福利，年终奖，通讯补贴，股票期权，补充医疗保险，全勤奖，餐补，离职补偿,https://www.zhipin.com/job_detail/e79d8ff82998787e1XVy3tu7EFNT.html
Python中级工程师（金融方向）,上海·黄浦区·城隍庙,16-19K,3-5年本科,宝旗信息,计算机软件不需要融资100-499人,员工旅游，团建活动，节日福利，餐补，带薪年假，零食下午茶，定期体检，补充医疗保险，五险一金,https://www.zhipin.com/job_detail/f412df4ee570cef71nN-3ty6FlZS.html
Python开发工程师,上海·普陀区·长征,12-20K,1-3年本科,侑虎科技,企业服务不需要融资20-99人,定期体检，带薪年假，五险一金，零食下午茶，节日福利，通讯补贴，员工旅游，交通补助，年终奖，餐补,https://www.zhipin.com/job_detail/d86bfcdb4dd3f7861nN73dm8E1FU.html
Python开发工程师,上海·嘉定区·嘉定镇,9-14K,经验不限本科,商江网络,互联网不需要融资20-99人,带薪年假，定期体检，加班补助，年终奖，股票期权，节日福利，员工旅游，通讯补贴，全勤奖，五险一金,https://www.zhipin.com/job_detail/a2266a31ab60d3591nJ63dq1F1dV.html
python开发工程师,上海·浦东新区·张江,15-30K·15薪,1-3年本科,量投科技,计算机软件未融资100-499人,五险一金，交通补助，补充医疗保险，股票期权，定期体检，节日福利，年终奖，带薪年假，员工旅游,https://www.zhipin.com/job_detail/bb803723e6d38e341nN_3dW6EFBU.html
初级Python工程师（上海）,上海·浦东新区·陆家嘴,8-13K,1-3年本科,文因互联,计算机软件A轮20-99人,免费班车，交通补助，餐补，带薪年假，节日福利，五险一金，补充医疗保险，定期体检，年终奖,https://www.zhipin.com/job_detail/b096ae2b31e6f97a1nZ-2N6-F1pY.html
Python开发工程师,上海·虹口区·周家嘴路,15-25K,3-5年本科,歌斐资产,互联网金融100-499人,,https://www.zhipin.com/job_detail/f4a41647b59921531X1-0tm1GFI~.html
python量化开发工程师,上海·浦东新区·三林,12-24K,经验不限本科,红链科技,基金0-20人,,https://www.zhipin.com/job_detail/7349af487440c8d81nJ63du4ElpR.html
Python运维开发程序员,上海·浦东新区·康桥,6-10K,经验不限大专,麦特莱吉,机械设备/机电/重工未融资20-99人,员工旅游，年终奖，交通补助，五险一金，带薪年假，零食下午茶，节日福利,https://www.zhipin.com/job_detail/8c1aea5c54e69dec1nN82tm7EFNW.html
Python高级开发工程师,上海·徐汇区·田林,20-30K,5-10年本科,猎脉,咨询20-99人,,https://www.zhipin.com/job_detail/728ea9c2742ff86f1n172t66F1JV.html
Python量化开发工程师,上海·浦东新区·花木,18-35K,3-5年本科,朗闰,计算机服务20-99人,,https://www.zhipin.com/job_detail/9c5fa046d2730a211n1_3N-7GFdX.html
python电商网站爬虫程序员,上海·浦东新区·新场,50-80K·16薪,经验不限学历不限,上海念露,文化/体育/娱乐0-20人,员工旅游，零食下午茶，包吃，股票期权,https://www.zhipin.com/job_detail/20d203c256e97e7c1nJ73Ny6F1VZ.html
Python脚本开发工程师,上海·闵行区·莘庄,10-15K,3-5年大专,窝阔网络科技,计算机软件未融资0-20人,包吃，餐补，五险一金,https://www.zhipin.com/job_detail/6bc2b61c8b9ab5e11nZz2N2_ElNV.html
Python 开发工程师,上海·杨浦区·五角场,25-40K·14薪,3-5年本科,格物钛,互联网A轮20-99人,五险一金，零食下午茶，交通补助，定期体检，节日福利，年终奖，员工旅游，带薪年假，股票期权,https://www.zhipin.com/job_detail/bd87d6f11e4259191nJ82tm4EVdR.html
量化开发工程师(python/c++),上海·长宁区·仙霞,15-30K,3-5年本科,海翔网络,互联网金融天使轮20-99人,五险一金，年终奖，定期体检，加班补助，股票期权,https://www.zhipin.com/job_detail/550f16a8c297fda11n152Nq9EFFZ.html
金融工程分析师（Python开发/数据开发）,上海·杨浦区·五角场,10-15K,1-3年本科,谦璞投资,投资/融资不需要融资20-99人,五险一金，零食下午茶，年终奖，员工旅游，节日福利,https://www.zhipin.com/job_detail/b402a8da8528d09a1nN52dq-EVZV.html
Python开发（双休，一线大厂，双倍薪资）,上海·浦东新区·金桥,11-22K,经验不限本科,中软国际,计算机软件已上市10000人以上,带薪年假，餐补，定期体检，员工旅游，五险一金，零食下午茶，节日福利，加班补助，年终奖，免费班车,https://www.zhipin.com/job_detail/85d0d9c546fa2fc11XV83dy6FVJS.html
python开发,上海·浦东新区·金桥,1-2K,在校/应届本科,华为,计算机软件不需要融资10000人以上,员工旅游，定期体检，股票期权，餐补，补充医疗保险，加班补助，零食下午茶，节日福利，五险一金，年终奖,https://www.zhipin.com/job_detail/8a6029083f2972d91nN53dS5GVpU.html
高级Python交付工程师,上海·浦东新区·张江,12-24K·13薪,3-5年本科,自然而然,互联网天使轮20-99人,节日福利，五险一金，零食下午茶，年终奖，带薪年假,https://www.zhipin.com/job_detail/ac7d4d826e9a74a31nJz0ty1FFFY.html
python开发工程师,上海·浦东新区·张江,20-35K·13薪,3-5年本科,逾谦科技,移动互联网不需要融资0-20人,五险一金，年终奖，员工旅游，带薪年假，股票期权,https://www.zhipin.com/job_detail/1422973442320be21nF909W1FVZX.html
python开发工程师,上海,20-35K·15薪,3-5年大专,乐言科技,互联网D轮及以上1000-9999人,五险一金，零食下午茶，年终奖，节日福利，补充医疗保险，定期体检，带薪年假,https://www.zhipin.com/job_detail/14b818f10a15f52e1nJ-39y0GFNV.html
Python开发工程师,上海·浦东新区·张江,16-30K,3-5年大专,软通动力信息技术集团,计算机软件已上市10000人以上,定期体检，餐补，节日福利，年终奖，员工旅游，零食下午茶，五险一金，交通补助，包吃，免费班车，加班补助，通讯补贴，全勤奖，带薪年假，补充医疗保险,https://www.zhipin.com/job_detail/66a2fd2d853db2751n1_3di8E1VZ.html
Python运维开发（006）,上海·浦东新区·张江,15-25K·13薪,3-5年大专,上海敏智,计算机软件未融资20-99人,节日福利，带薪年假，五险一金，零食下午茶，餐补，员工旅游，年终奖，全勤奖，加班补助,https://www.zhipin.com/job_detail/fe73e0bd5d6f9a951n160ti4FFNU.html
Python 教师 弹性工作制,上海·徐汇区·龙华,5-10K,经验不限本科,慕客信,在线教育天使轮0-20人,员工旅游，带薪年假，股票期权，五险一金，年终奖，交通补助,https://www.zhipin.com/job_detail/b1ce2aedeea72d8a1nB83NS4F1VU.html
实习生（Python开发）,上海·杨浦区·东外滩,150-200元/天,4天/周3个月本科,得物App,电子商务B轮1000-9999人,五险一金，股票期权，员工旅游，年终奖，带薪年假，零食下午茶，加班补助，交通补助，住房补贴，节日福利，定期体检，餐补,https://www.zhipin.com/job_detail/d063e281626cbd231XV-3N6-FlNR.html
Python,上海·杨浦区·五角场,20-40K,经验不限本科,华云数据,数据服务D轮及以上500-999人,餐补，免息购房，股票期权，带薪年假，定期体检，节日福利，年终奖，五险一金,https://www.zhipin.com/job_detail/d5c876ec267e3cec1n1y39W6EVZV.html
Python开发工程师,上海·长宁区·新华路,12-18K,1-3年本科,洪朴信息,数据服务A轮20-99人,节日福利，带薪年假，员工旅游，年终奖，五险一金，交通补助，零食下午茶，定期体检,https://www.zhipin.com/job_detail/efd4e2d5a3b012951XR-3t67ElBT.html
数据实习python,上海·浦东新区·张江,3-4K,经验不限大专,国音智能,互联网B轮100-499人,团建经费，节日福利，五险一金，定期体检，零食下午茶，餐补，带薪年假，年终奖,https://www.zhipin.com/job_detail/781162363c5991f21XR70t6_ElVZ.html
python算法工程师,上海·杨浦区·五角场,15-20K,1-3年本科,晏鼠股份,互联网未融资20-99人,节日福利，五险一金，全勤奖，年终奖，员工旅游,https://www.zhipin.com/job_detail/3ed112d095aecdc41HB639u6E1Y~.html
Python后端工程师,上海·杨浦区·五角场,13-25K·14薪,1-3年本科,脉策科技,互联网B轮100-499人,节日福利，人才引进落户，带薪年假，五险一金，年终奖，补充医疗保险，员工旅游，定期体检,https://www.zhipin.com/job_detail/e15ce307fdd2baa51XR409W-FFNQ.html
python开发工程师,上海·浦东新区·金桥,15-30K,经验不限本科,天弘正信,计算机服务20-99人,,https://www.zhipin.com/job_detail/f3d0116f22d4ebec1nNz2Ni0FVBX.html
python后端开发工程师,上海·徐汇区·龙华,16-30K·14薪,3-5年本科,旭荣科技,互联网未融资20-99人,餐补，1年2次调薪，健身俱乐部，五险一金，定期海外旅游，结婚礼金，零食下午茶，定期团建，慰问礼金，年终奖，生育礼金，定期户外拓展，国家法定假期，带薪病假，补充医疗保险，带薪年假，节日福利,https://www.zhipin.com/job_detail/dfe34cd6ab89d05a1nZz2NW1GFJR.html
编程老师/Scratch、python，做五休二,上海·闵行区·莘庄,10-14K,经验不限本科,斯坦星球,培训机构B轮500-999人,年终奖，节日福利，五险一金，定期体检，带薪年假，股票期权，零食下午茶，员工旅游,https://www.zhipin.com/job_detail/228431657d9be25f1n1_2Ni_FlFT.html
Python开发工程师,上海·杨浦区·五角场,15-30K,经验不限本科,华云数据,数据服务D轮及以上500-999人,五险一金，免息购房，年终奖，餐补，节日福利，股票期权，定期体检，带薪年假,https://www.zhipin.com/job_detail/6b0043e37ccf457c1XV629q-EVpT.html
python开发测试工程师,上海·浦东新区·金桥,15-30K,1-3年本科,华为,计算机软件不需要融资10000人以上,加班补助，年终奖，员工旅游，零食下午茶，定期体检，五险一金，补充医疗保险，股票期权，节日福利，餐补,https://www.zhipin.com/job_detail/d69f4ae8402a6e511nJ62N61FFpQ.html
python自动化测试,上海·浦东新区·金桥,8-13K,1-3年本科,软通动力,计算机软件已上市10000人以上,团建活动，交通补助，定期体检，带薪年假，免费班车，加班补助，五险一金，零食下午茶，节日福利,https://www.zhipin.com/job_detail/e01d6748d309a45e0HN52Ni0E1s~.html
python后端开发工程师,上海·杨浦区·五角场,15-25K·14薪,3-5年本科,脉策科技,互联网B轮100-499人,人才引进落户，员工旅游，带薪年假，定期体检，五险一金，年终奖，补充医疗保险，节日福利,https://www.zhipin.com/job_detail/7d5e9739ac2cee001n1_2dS-GVFW.html
高级Python开发工程师,上海·浦东新区·张江,12-24K·13薪,3-5年本科,自然而然,互联网天使轮20-99人,节日福利，带薪年假，五险一金，年终奖，零食下午茶,https://www.zhipin.com/job_detail/b0d640195ea469161XVy3N69F1pY.html
python软件开发工程师,上海·浦东新区·金桥,16-25K,3-5年本科,华为技术有限公司,计算机软件不需要融资10000人以上,餐补，带薪年假，补充医疗保险，住房补贴，交通补助，定期体检，员工旅游，节日福利，通讯补贴，加班补助，零食下午茶，股票期权，全勤奖，五险一金，免费班车，年终奖，离职补偿,https://www.zhipin.com/job_detail/5b2eb4bffd4037041nZ639W8F1NS.html
中高级Python后端开发工程师,上海·徐汇区·龙华,16-30K·14薪,3-5年本科,旭荣科技,互联网未融资20-99人,定期团建，补充医疗保险，健身俱乐部，定期海外旅游，国家法定假期，五险一金，年终奖，零食下午茶，1年2次调薪，生育礼金，慰问礼金，节日福利，结婚礼金，餐补，定期户外拓展，带薪年假，带薪病假,https://www.zhipin.com/job_detail/203b9c0ff29080bb1nZ-3969ElZY.html
Python工程师,上海·徐汇区·漕河泾,13-18K·13薪,1-3年本科,烯牛数据,数据服务A轮20-99人,补充医疗保险，定期体检，零食下午茶，带薪年假，五险一金，节日福利，员工旅游，年终奖，股票期权,https://www.zhipin.com/job_detail/e758a2ac4322cda01nRz3dS-EFE~.html
Python前端工程师,上海·杨浦区·五角场,8-12K,1-3年本科,书怡网络,互联网0-20人,,https://www.zhipin.com/job_detail/da7a07617eb9ea2d1nV63N-1GFRY.html
python初级爬虫工程师,上海·杨浦区·中原,6-10K·13薪,经验不限本科,昔今体育,文化/体育/娱乐不需要融资20-99人,零食下午茶，节日福利，定期体检，年终奖，五险一金，加班补助,https://www.zhipin.com/job_detail/dec058dd06f8eacb33N409S8FFo~.html
rpa实施工程师(python开发),上海·闵行区·华漕,5-10K,经验不限大专,云钠科技,计算机软件A轮100-499人,定期体检，股票期权，零食下午茶，年终奖，五险一金，节日福利，员工旅游，带薪年假,https://www.zhipin.com/job_detail/953e791c7d5a2c291n1-09W9E1ZU.html
高级python交付工程师,上海·浦东新区·张江,12-24K·13薪,3-5年本科,自然而然,互联网天使轮20-99人,零食下午茶，年终奖，五险一金，节日福利，带薪年假,https://www.zhipin.com/job_detail/73984290012a83971n183926FltT.html
编程老师/scratch/python/wedo,上海,8-12K,1年以内大专,昂立教育,培训机构已上市1000-9999人,定期体检，年终奖，带薪年假，五险一金，培训补贴，员工旅游，节日福利,https://www.zhipin.com/job_detail/553357654038b1841nV72d6_FFFX.html
【德科OD-华为】python开发（AI算法方向）,上海·浦东新区·金桥,15-30K·15薪,经验不限本科,华为技术有限公司,计算机软件不需要融资10000人以上,加班补助，五险一金，免费班车，员工旅游，带薪年假，零食下午茶，住房补贴，补充医疗保险，全勤奖，股票期权，年终奖，通讯补贴，交通补助，离职补偿，餐补，定期体检，节日福利,https://www.zhipin.com/job_detail/f7ad267b3e8a908d1nB-3NS_GFNQ.html
机器人编程老师（python，c++）,上海·长宁区·中山公园,7-10K,经验不限学历不限,智慧喵,在线教育A轮100-499人,股票期权，年终奖，加班补助，全勤奖，五险一金，带薪年假，员工旅游，节日福利,https://www.zhipin.com/job_detail/a9c618222dc2749c1nBy3NW-FlNV.html
python 实习,上海·静安区·静安寺,120-160元/天,3天/周3个月大专,数智博,医疗设备/器械20-99人,,https://www.zhipin.com/job_detail/a0fe247a3c7639f51XV_09-1GFtT.html
python 开发工程师,上海,12-24K,1-3年本科,成同网络,移动互联网不需要融资20-99人,年终奖，加班补助，带薪年假，全勤奖，免费班车，餐补，节日福利，员工旅游，包吃，五险一金，零食下午茶,https://www.zhipin.com/job_detail/641e2b35c3b6ea6e1nF83N61F1tV.html
Python 后端开发,上海·浦东新区·临港,10-15K,1-3年本科,擎翌智能,智能硬件未融资20-99人,年终奖，五险一金，交通补助，员工旅游,https://www.zhipin.com/job_detail/e368d160ddf3e4c61XR70tW_GFZW.html
Python Web实习生,上海·松江区·九亭,150-200元/天,6天/周12个月本科,担路网,企业服务未融资20-99人,全勤奖，带薪年假，节日福利，年终奖，五险一金，交通补助，通讯补贴,https://www.zhipin.com/job_detail/75411f76e5f55fa80X172tW7E1M~.html
Python Machine Learning Engineer,上海·浦东新区·陆家嘴,20-40K·14薪,5-10年本科,丰伍吉科技,计算机软件未融资100-499人,带薪年假，五险一金，加班补助，零食下午茶，年终奖,https://www.zhipin.com/job_detail/ff3cdfc58c6f30aa1XR_3dW9FlFR.html
Python 数据工程师,上海·静安区·南京西路,9-12K,1-3年本科,心盒科技,广告/公关/会展天使轮20-99人,年终奖，零食下午茶，五险一金，股票期权，补充医疗保险，餐补,https://www.zhipin.com/job_detail/721c8babd9b2a5d61XR-3t2_E1VZ.html
Graduate Python Engineer,上海·徐汇区·徐家汇,15-25K,在校/应届本科,道阁国际贸易有限公司,投资/融资不需要融资100-499人,员工旅游，零食下午茶，通讯补贴，五险一金，补充医疗保险，带薪年假，年终奖,https://www.zhipin.com/job_detail/9ad14bb9ff175ea21XR53tS9FltT.html
Python 后端开发,上海,8-10K,1-3年大专,普美瑞,医疗健康未融资100-499人,带薪年假，定期体检，员工旅游，节日福利，五险一金,https://www.zhipin.com/job_detail/e48bd431ab5d6a611nN62t21FVRW.html
Python 后端工程师,上海·长宁区·仙霞,10-15K·13薪,1-3年本科,戎磐,信息安全B轮100-499人,加班补助，带薪年假，零食下午茶，年终奖，季度团建，额外假期，生日福利，定期体检，五险一金，股票期权，家庭福利，节日福利，员工旅游,https://www.zhipin.com/job_detail/fcb7d9bec62905d01nd639y8E1FY.html
Python WEB开发,上海·长宁区·新华路,8-12K,1-3年本科,麦开信息,互联网不需要融资0-20人,五险一金,https://www.zhipin.com/job_detail/0004f592ce1981ab1nZ709i5GVtT.html
python开发工程师,上海,18-35K·15薪,1-3年本科,华为技术有限公司,计算机软件不需要融资10000人以上,全勤奖，员工旅游，年终奖，通讯补贴，免费班车，交通补助，定期体检，节日福利，餐补，股票期权，补充医疗保险，离职补偿，住房补贴，五险一金，加班补助，零食下午茶，带薪年假,https://www.zhipin.com/job_detail/3d4ea5262ee5794a1nB82Ny6GVpX.html
存储系统开发工程师 python,上海·闵行区·合川路,25-35K,经验不限本科,天玑科技,数据服务已上市500-999人,五险一金，餐补，补充医疗保险，带薪年假，交通补助，定期体检，通讯补贴,https://www.zhipin.com/job_detail/7888bc58be3a15d11nZ429y8GFQ~.html
python web开发工程师,上海·杨浦区·五角场,10-15K,1年以内本科,光际科技,智能硬件天使轮20-99人,五险一金，零食下午茶，带薪年假，员工旅游，股票期权，年终奖，节日福利,https://www.zhipin.com/job_detail/1ab0c70c22e5c23a031_2t68EVc~.html
Python Web 开发工程师,上海·静安区·火车站,10-15K,3-5年本科,浩御,广告/公关/会展未融资20-99人,节日福利，交通补助，餐补，五险一金，年终奖，定期体检，带薪年假，全勤奖，员工旅游,https://www.zhipin.com/job_detail/1f86e35758901a281XV73Nm4FFpZ.html
Python 后端开发工程师,上海·闵行区·颛桥,20-40K·13薪,3-5年本科,千居智,计算机硬件A轮0-20人,五险一金,https://www.zhipin.com/job_detail/798c548febd013bc1XV50926FlFQ.html
Python 开发工程师(J10811),上海·宝山区·上海大学,13-25K·14薪,1-3年本科,创新奇智,计算机服务已上市500-999人,节日福利，员工旅游，餐补，年终奖，股票期权，带薪年假，五险一金，补充医疗保险，通讯补贴，定期体检,https://www.zhipin.com/job_detail/5c38be4851cb1fcb1XV_29u-FldR.html
Python Web 中级开发工程师,上海·长宁区·古北,12-20K·13薪,1-3年本科,治吉科技,计算机软件天使轮20-99人,股票期权，餐补，员工旅游，年终奖，加班补助，带薪年假，补充医疗保险，节日福利，定期体检，五险一金，零食下午茶,https://www.zhipin.com/job_detail/86e9c2f0f47e4ca61XR-3tS1FlBU.html
Python 后台开发工程师,上海·徐汇区·徐家汇,15-25K·13薪,1-3年本科,媒智科技,互联网A轮20-99人,餐补，带薪年假，零食下午茶，年终奖，员工旅游，股票期权，五险一金，节日福利,https://www.zhipin.com/job_detail/12cdefd6b922606d0nV-2t6_ElE~.html
Python Flask Web工程师,上海·闵行区·七宝,12-24K,3-5年大专,三育教育,学前教育未融资1000-9999人,五险一金，年终奖，带薪年假，包吃，加班补助，定期体检，员工旅游,https://www.zhipin.com/job_detail/c4d8703edd86ec061XRz2tq_EFVQ.html
RISK - Python 开发工程师,上海·黄浦区·新天地,20-40K,3-5年本科,野村信息,计算机软件不需要融资100-499人,五险一金，带薪年假，补充医疗保险，年终奖，节日福利,https://www.zhipin.com/job_detail/3d72a9271b234f911XV40tW-GFZU.html
Python 后端研发工程师,上海·嘉定区·江桥,15-25K,经验不限本科,观安信息,信息安全D轮及以上1000-9999人,零食下午茶，通讯补贴，五险一金，交通补助，加班补助，员工旅游，带薪年假，股票期权，节日福利，年终奖，定期体检,https://www.zhipin.com/job_detail/422638fa2e1793051nN62dS_F1ZX.html
Python 后端开发工程师,上海·虹口区·江湾,12-20K,1年以内本科,亿可能源,企业服务A轮20-99人,定期体检，加班补助，节日福利，餐补，股票期权，五险一金，带薪年假，员工旅游，年终奖,https://www.zhipin.com/job_detail/05baa0b398d8a2591XZ729-6FFQ~.html
